id,gender,masterCategory,subCategory,articleType,baseColour,season,year,usage,productDisplayName,image
51805,Women,Apparel,Innerwear,Bra,Pink,Summer,2016,Casual,Bwitch Light Pink Bra,51805.jpg
55499,Women,Personal Care,Lips,Lip Gloss,Pink,Spring,2017,Casual,Revlon Pink Ice Glace Rose Colorburst Lip Gloss 004,55499.jpg
9233,Men,Apparel,Topwear,Shirts,Blue,Fall,2011,Formal,Mark Taylor Men Blue Striped Shirt,9233.jpg
48114,Women,Accessories,Belts,Belts,Multi,Summer,2012,Casual,Fossil Women Multi Coloured Quilted Squares Belt,48114.jpg
29123,Men,Footwear,Shoes,Sports Shoes,White,Summer,2012,Sports,Puma Men Aquil White Sports Shoes,29123.jpg
51039,Women,Apparel,Innerwear,Briefs,Brown,Summer,2017,Casual,Enamor Women Brown Floral Printed Briefs,51039.jpg
26957,Women,Apparel,Topwear,Shirts,Purple,Summer,2012,Casual,Jealous 21 Women Purple Shirt,26957.jpg
27885,Women,Apparel,Topwear,Shirts,Blue,Summer,2012,Formal,Scullers For Her Blue Shirt,27885.jpg
30832,Women,Apparel,Bottomwear,Churidar,Blue,Summer,2012,Ethnic,Fabindia Women Printed Blue & Red Churidar,30832.jpg
48928,Women,Accessories,Jewellery,Ring,Silver,Summer,2012,Casual,Lucera Women Silver Ring,48928.jpg
1862,Men,Apparel,Topwear,Tshirts,Grey,Summer,2011,Casual,Inkfruit Mens Urban Warfare T-shirt,1862.jpg
59254,Men,Accessories,Watches,Watches,White,Winter,2016,Casual,Titan Men White Dial Watch,59254.jpg
10409,Men,Apparel,Topwear,Tshirts,Green,Fall,2011,Casual,United Colors of Benetton Men Green Polo Tshirts,10409.jpg
15947,Men,Accessories,Ties,Ties,Maroon,Fall,2011,Formal,Turtle Men Stripes Maroon Ties,15947.jpg
32759,Men,Apparel,Topwear,Shirts,Purple,Summer,2012,Casual,Indigo Nation Men Striped Purple Shirt,32759.jpg
48789,Women,Accessories,Jewellery,Pendant,Silver,Summer,2015,Casual,Lucera Women Silver Pendant,48789.jpg
30693,Women,Footwear,Shoes,Heels,Brown,Winter,2015,Casual,Catwalk Women Brown Heels,30693.jpg
2046,Men,Apparel,Topwear,Tshirts,Blue,Fall,2010,Casual,ADIDAS Mens Fitted Blue T-shirt,2046.jpg
27624,Men,Apparel,Bottomwear,Shorts,Cream,Summer,2012,Casual,Scullers Men Cream Shorts,27624.jpg
13411,Men,Apparel,Topwear,Shirts,Pink,Summer,2011,Casual,United Colors of Benetton Men Stripes Pink Shirts,13411.jpg
23284,Men,Accessories,Watches,Watches,Black,Winter,2016,Casual,Maxima Ssteele Men Black Watch,23284.jpg
50776,Men,Footwear,Sandal,Sandals,Brown,Winter,2013,Casual,Clarks Men Brown Leather Sandals,50776.jpg
34233,Men,Apparel,Topwear,Tshirts,Mustard,Summer,2013,Casual,Proline Men Mustard Yellow T-shirt,34233.jpg
7534,Men,Apparel,Topwear,Tshirts,White,Summer,2011,Sports,Nike men's As Nike Spher White Orange T-shirt,7534.jpg
19917,Unisex,Accessories,Bags,Backpacks,Black,Winter,2015,Casual,Wildcraft Unisex Black Backpack,19917.jpg
46613,Women,Footwear,Shoes,Heels,Grey,Summer,2012,Casual,Catwalk Women Multi Coloured Sandals,46613.jpg
16163,Men,Footwear,Shoes,Formal Shoes,Tan,Fall,2011,Formal,Enroute Men Leather Tan Formal Shoes,16163.jpg
22356,Men,Apparel,Topwear,Shirts,White,Fall,2011,Casual,John Players Men Solid White Shirt,22356.jpg
52021,Women,Apparel,Loungewear and Nightwear,Lounge Tshirts,Brown,Summer,2016,Casual,Inaya Women Lounge Top,52021.jpg
45096,Women,Apparel,Innerwear,Bra,Purple,Winter,2015,Casual,Bwitch Purple Full-Coverage Lace Bra RTV-BW334,45096.jpg
36564,Women,Personal Care,Fragrance,Deodorant,Purple,Spring,2017,Casual,United Colors of Benetton Women Deo,36564.jpg
5263,Unisex,Accessories,Bags,Messenger Bag,Grey,Winter,2015,Casual,Wildcraft Unisex Grey & Green Printed Messenger Bag,5263.jpg
44144,Men,Personal Care,Fragrance,Perfume and Body Mist,Black,Spring,2017,Casual,Boss Men Number One Perfume,44144.jpg
20401,Women,Accessories,Belts,Belts,Purple,Winter,2015,Casual,Baggit Women Tickle Taj Purple Belt,20401.jpg
41436,Men,Footwear,Shoes,Sports Shoes,White,Fall,2012,Casual,Lee Cooper Men Black & White Sports Shoes,41436.jpg
25173,Women,Accessories,Bags,Handbags,Brown,Winter,2015,Casual,Lino Perros Women Leatherette Brown Handbag,25173.jpg
56481,Women,Personal Care,Nails,Nail Polish,Maroon,Spring,2017,Casual,Streetwear Bride's Delight Nail Polish 52,56481.jpg
11346,Men,Apparel,Bottomwear,Jeans,Blue,Spring,2013,Casual,Lee Men Blue Zed Fit Jeans,11346.jpg
10294,Men,Footwear,Shoes,Formal Shoes,Brown,Fall,2012,Formal,Clarks Men Feeling Good Leather Brown Formal Shoes,10294.jpg
57553,Women,Personal Care,Lips,Lipstick,Brown,Spring,2017,Casual,Lotus Herbals Floralstay Truffle Story Lip Color 423,57553.jpg
44978,Women,Accessories,Watches,Watches,Black,Winter,2016,Casual,Maxima Women Black Dial Watch,44978.jpg
33016,Women,Apparel,Topwear,Kurtas,Black,Summer,2012,Ethnic,Mother Earth Women Striped Black & Maroon Kurta,33016.jpg
4183,Men,Footwear,Shoes,Casual Shoes,Brown,Summer,2011,Casual,Rockport Men Brown Leather Casual Shoes,4183.jpg
11948,Men,Footwear,Shoes,Casual Shoes,Black,Summer,2012,Casual,Ganuchi Men Casual Black Casual Shoes,11948.jpg
36756,Women,Accessories,Watches,Watches,White,Winter,2016,Casual,Maxima Women White Dial Watch,36756.jpg
58729,Women,Apparel,Topwear,Tshirts,Blue,Summer,2012,Casual,Puma Women Blue T-shirt,58729.jpg
37684,Unisex,Accessories,Bags,Backpacks,Blue,Summer,2012,Casual,American Tourister Unisex Blue Backpack,37684.jpg
44376,Women,Apparel,Topwear,Waistcoat,Blue,Summer,2012,Casual,ONLY Women Blue Waistcoat,44376.jpg
11174,Men,Apparel,Topwear,Sweaters,Green,Fall,2011,Casual,Scullers Men Stripes Green Sweaters,11174.jpg
33224,Women,Apparel,Topwear,Tops,Black,Summer,2012,Casual,Sepia Women Striped Black Top,33224.jpg
57761,Women,Personal Care,Skin Care,Face Wash and Cleanser,Cream,Spring,2017,Casual,Lotus Herbals Tea Tree & Cinnamon Anti-Acne Oil Control Face Wash,57761.jpg
24293,Men,Accessories,Socks,Socks,Grey,Summer,2016,Casual,Quiksilver Men High Grey Socks,24293.jpg
27416,Women,Apparel,Bottomwear,Capris,Grey Melange,Winter,2015,Casual,Jockey Women Grey Melange Relaxed Fit Capris 1306,27416.jpg
43153,Men,Accessories,Watches,Watches,Brown,Summer,2017,Casual,Fastrack Men Brown Dial Watch NE1478SM02,43153.jpg
2274,Men,Apparel,Topwear,Tshirts,White,Fall,2010,Sports,Nike Mens AS White T-shirt,2274.jpg
42081,Men,Accessories,Wallets,Wallets,Brown,Summer,2012,Casual,American Tourister Men Brown Slim Fold Wallet,42081.jpg
22958,Men,Footwear,Shoes,Sports Shoes,White,Summer,2012,Sports,Reebok Men White Acciomax Sports Shoes,22958.jpg
49469,Men,Footwear,Shoes,Casual Shoes,Maroon,Summer,2012,Casual,Vans Men Maroon Vulcanized Canvas Shoes,49469.jpg
19319,Unisex,Accessories,Bags,Backpacks,Grey,Fall,2011,Casual,Nike Unisex Casual Grey Backpack,19319.jpg
55036,Women,Personal Care,Lips,Lipstick,Brown,Spring,2017,Casual,Lakme Absolute Matte Expresso Lipstick 55,55036.jpg
34001,Women,Apparel,Topwear,Tops,Brown,Summer,2012,Casual,Femella Women Brown Top,34001.jpg
50544,Men,Apparel,Innerwear,Briefs,White,Summer,2016,Casual,Chromozome Men White Brief,50544.jpg
17283,Men,Apparel,Topwear,Tshirts,Brown,Fall,2011,Casual,U.S. Polo Assn. Men Stripes Brown Polo Tshirt,17283.jpg
16351,Men,Apparel,Topwear,Shirts,Cream,Fall,2011,Formal,Peter England Men Stripes Cream Shirt,16351.jpg
22164,Men,Footwear,Shoes,Casual Shoes,Brown,Fall,2012,Casual,Timberland Men Brown Casual Shoes,22164.jpg
7706,Women,Apparel,Topwear,Tops,Black,Fall,2011,Casual,Jealous 21 Women's She's Got Attitude Black Top,7706.jpg
14062,Men,Apparel,Topwear,Tshirts,Grey,Fall,2011,Casual,Flying Machine Men Stripes Grey Polo Tshirts,14062.jpg
20257,Men,Apparel,Topwear,Tshirts,Blue,Fall,2011,Casual,Wrangler Men Wing Blue Tshirt,20257.jpg
5435,Men,Apparel,Topwear,Tshirts,Grey,Summer,2011,Sports,Nike Men's Encourage The Rookies Grey T-shirt,5435.jpg
44712,Men,Footwear,Flip Flops,Flip Flops,Black,Summer,2010,Casual,Lotto Men Black Campione Flip Flop,44712.jpg
36332,Men,Accessories,Socks,Socks,Black,Summer,2016,Casual,Playboy Men Black and White Socks,36332.jpg
21385,Men,Apparel,Bottomwear,Track Pants,Navy Blue,Fall,2011,Casual,Manchester United Men Solid Navy Blue Track Pants,21385.jpg
52677,Men,Accessories,Watches,Watches,Silver,Winter,2016,Casual,Morellato Men Silver Dial Watch,52677.jpg
57305,Women,Footwear,Shoes,Heels,Black,Winter,2012,Casual,Rocia Women Black Heels,57305.jpg
11510,Women,Footwear,Shoes,Heels,Beige,Winter,2015,Casual,Catwalk Women Lifestyle Beige Flats,11510.jpg
41260,Men,Accessories,Wallets,Wallets,Brown,Summer,2012,Casual,Arrow Men Brown Wallet,41260.jpg
31117,Girls,Apparel,Topwear,Tops,White,Summer,2012,Casual,Gini and Jony Girls White Top,31117.jpg
12395,Men,Accessories,Socks,Socks,Blue,Summer,2016,Formal,Reid & Taylor Men Solid Blue Socks,12395.jpg
46879,Men,Accessories,Socks,Socks,Green,Summer,2012,Casual,Lino Perros Men Pack of 2 Socks,46879.jpg
13247,Men,Apparel,Bottomwear,Jeans,Blue,Fall,2011,Casual,Palm Tree Kids Boy Washed Blue Jeans,13247.jpg
54580,Women,Apparel,Topwear,Kurtas,Red,Summer,2012,Ethnic,Sushilas Women Printed Red Kurta,54580.jpg
28806,Men,Apparel,Topwear,Shirts,Black,Summer,2012,Casual,Denizen Men Check Black Shirt,28806.jpg
43537,Women,Apparel,Topwear,Tops,Green,Summer,2012,Casual,French Connection Women Green Top,43537.jpg
2610,Women,Footwear,Shoes,Heels,Black,Winter,2012,Casual,Carlton London Women Stylish Black Flats,2610.jpg
16735,Men,Footwear,Flip Flops,Flip Flops,Black,Fall,2011,Casual,Lotto Men Emeriti Black Slipper,16735.jpg
49831,Women,Footwear,Flip Flops,Flip Flops,Blue,Winter,2012,Casual,iPanema Women Blue Flip Flops,49831.jpg
22500,Women,Footwear,Shoes,Casual Shoes,Blue,Winter,2015,Casual,Catwalk Women Blue Casual Shoes,22500.jpg
7362,Women,Apparel,Topwear,Tops,Blue,Summer,2011,Casual,UCB Women's Graphic Print Sequins Blue Top,7362.jpg
46045,Women,Accessories,Jewellery,Earrings,Gold,Winter,2016,Casual,Estelle Gold Earrings,46045.jpg
47197,Men,Footwear,Sandal,Sandals,Black,Summer,2010,Casual,Franco Leone Men Black Sandals,47197.jpg
34465,Unisex,Accessories,Bags,Backpacks,Black,Summer,2010,Casual,ADIDAS Unisex Black BP Tone Backpack,34465.jpg
31325,Women,Apparel,Topwear,Kurtas,Purple,Summer,2012,Ethnic,Aurelia Women Printed Purple Kurta,31325.jpg
8118,Men,Accessories,Belts,Belts,Brown,Winter,2016,Casual,Fastrack Men Khaki Canvas Brown Belts,8118.jpg
43705,Women,Accessories,Jewellery,Jewellery Set,White,Summer,2012,Ethnic,Royal Diadem White Jewellery Set,43705.jpg
13075,Men,Footwear,Shoes,Casual Shoes,Black,Summer,2013,Casual,Numero Uno Men Black Shoes,13075.jpg
7150,Women,Apparel,Topwear,Tops,Black,Fall,2011,Casual,Scullers For Her Women's Wow Knit Black Purple Top,7150.jpg
35785,Women,Footwear,Shoes,Flats,Orange,Summer,2012,Casual,Enroute Women Coral Shoes,35785.jpg
46277,Women,Apparel,Dress,Dresses,Red,Summer,2012,Casual,109F Red & White A-Line Dress,46277.jpg
16507,Men,Apparel,Bottomwear,Jeans,Blue,Fall,2011,Casual,Locomotive Men Washed Blue Jeans,16507.jpg
8924,Men,Accessories,Belts,Belts,Black,Winter,2015,Casual,Puma Men Cat  Black Belt,8924.jpg
22732,Men,Footwear,Shoes,Sports Shoes,Olive,Fall,2011,Sports,Nike Men Air Max Conquer ACG Olive Sports Boot,22732.jpg
28208,Men,Accessories,Eyewear,Sunglasses,Metallic,Winter,2016,Casual,Ray-Ban Men Active Lifestyle Metallic Sunglasses,28208.jpg
50312,Men,Accessories,Ties,Ties,Lavender,Summer,2012,Formal,Park Avenue Men Lavender Tie,50312.jpg
6082,Men,Apparel,Topwear,Tshirts,Blue,Summer,2011,Casual,UCB Men's Polo Neck Blue T-shirt,6082.jpg
13849,Men,Apparel,Topwear,Shirts,White,Fall,2011,Casual,Indigo Nation Men Check White Shirts,13849.jpg
44520,Men,Footwear,Sandal,Sandals,Khaki,Summer,2012,Casual,Coolers Men Khaki Sandals,44520.jpg
53597,Men,Accessories,Watches,Watches,Black,Winter,2016,Casual,Q&Q Men Black Digital Watch M086J001Y,53597.jpg
20065,Women,Accessories,Belts,Belts,Black,Fall,2011,Casual,United Colors of Benetton Women Solid Black Belt,20065.jpg
39974,Men,Footwear,Shoes,Casual Shoes,Brown,Winter,2014,Casual,Gas Men Brown Lear Shoes,39974.jpg
15382,Men,Footwear,Flip Flops,Flip Flops,Navy Blue,Fall,2011,Casual,Fila Men Terra Navy Blue Slippers,15382.jpg
52445,Women,Apparel,Loungewear and Nightwear,Nightdress,Pink,Winter,2015,Casual,Red Rose Pink & Black Nightdress,52445.jpg
57137,Women,Apparel,Bottomwear,Trousers,Khaki,Summer,2012,Casual,Elle Women Khaki Trousers,57137.jpg
58943,Women,Personal Care,Fragrance,Perfume and Body Mist,Blue,Spring,2017,Casual,Taylor of London Women Panache Perfume,58943.jpg
33472,Women,Accessories,Belts,Belts,Bronze,Summer,2012,Casual,Baggit Women Chapati Jassy Bronze Belt,33472.jpg
20859,Women,Accessories,Eyewear,Sunglasses,Brown,Winter,2016,Casual,United Colors of Benetton Women Casual Brown Sunglasses,20859.jpg
40180,Men,Accessories,Eyewear,Sunglasses,Black,Winter,2016,Casual,Fastrack Men UV Protected Sporty Wrap Sunglasses,40180.jpg
59891,Women,Apparel,Topwear,Shirts,Multi,Fall,2012,Casual,Femella Women Multi Coloured Shirt,59891.jpg
11722,Men,Apparel,Topwear,Shirts,Red,Summer,2011,Casual,Lee Men Check Red Shirts,11722.jpg
14096,Men,Apparel,Topwear,Tshirts,Blue,Fall,2011,Casual,Flying Machine Men Stripes Blue Tshirts,14096.jpg
53751,Women,Apparel,Bottomwear,Track Pants,Mauve,Summer,2012,Casual,ADIDAS Women Mauve Track Pant,53751.jpg
45634,Men,Apparel,Innerwear,Briefs,Black,Summer,2016,Casual,Park Avenue Men Black Swank Briefs,45634.jpg
4513,Unisex,Footwear,Shoes,Sports Shoes,Black,Summer,2011,Sports,Lotto Unisex Brooklyn Black Shoe,4513.jpg
52683,Men,Accessories,Watches,Watches,Silver,Winter,2016,Casual,Morellato Men Silver Dial Watch,52683.jpg
15144,Men,Apparel,Topwear,Shirts,White,Fall,2011,Casual,Arrow Sport Men Self-Stripes White Shirts,15144.jpg
10436,Men,Apparel,Topwear,Tshirts,Pink,Fall,2011,Casual,Flying Machine Men Pink Polo Tshirts,10436.jpg
24603,Women,Apparel,Topwear,Kurtas,White,Fall,2011,Ethnic,Vishudh Women White Printed Kurta,24603.jpg
56223,Men,Apparel,Loungewear and Nightwear,Night suits,Brown,Summer,2016,Casual,SDL by Sweet Dreams Men Brown Pyjama Set,56223.jpg
32766,Men,Apparel,Topwear,Shirts,White,Summer,2012,Formal,John Miller Men Striped White Shirt,32766.jpg
3736,Unisex,Accessories,Headwear,Caps,Orange,Fall,2010,Casual,Lotto Unisex Kochi Tuskers Orange Cap,3736.jpg
29920,Men,Accessories,Watches,Watches,Black,Winter,2016,Casual,Police Men Black Dial Chronograph Watch PL12699JSB,29920.jpg
42411,Men,Apparel,Innerwear,Briefs,Charcoal,Summer,2016,Casual,Basics Men Charcoal Hip Brief,42411.jpg
12361,Men,Apparel,Topwear,Shirts,Blue,Fall,2011,Formal,Reid & Taylor Men Solid Blue Shirts,12361.jpg
19789,Men,Apparel,Topwear,Tshirts,Orange,Winter,2016,Casual,U.S. Polo Assn. Men Solid Orange Tshirt,19789.jpg
26154,Men,Apparel,Bottomwear,Trousers,Black,Summer,2012,Formal,John Miller Men Black Trousers,26154.jpg
27086,Women,Footwear,Shoes,Flats,Black,Winter,2015,Casual,Catwalk Women Black Casual Flats,27086.jpg
54574,Women,Apparel,Topwear,Kurtas,Green,Summer,2012,Ethnic,Sushilas Women Printed Green Kurti,54574.jpg
51006,Women,Apparel,Innerwear,Bra,Brown,Summer,2017,Casual,Enamor Brown Bra,51006.jpg
35543,Girls,Footwear,Sandal,Sandals,Black,Summer,2012,Casual,Enroute Teens Black Sandals,35543.jpg
7396,Men,Footwear,Shoes,Casual Shoes,Grey,Winter,2018,Casual,Red Tape Men Grey Casual Shoes,7396.jpg
26968,Women,Apparel,Topwear,Tops,Purple,Summer,2012,Casual,Jealous 21 Women Check Purple Top,26968.jpg
47163,Men,Accessories,Belts,Belts,Black,Summer,2012,Casual,Peter England Men Black Belt,47163.jpg
6244,Women,Apparel,Topwear,Tshirts,Black,Summer,2011,Casual,Lee Women's Rihana Black T-shirt,6244.jpg
48917,Women,Accessories,Jewellery,Pendant,Silver,Summer,2015,Casual,Lucera Women Silver Pendant,48917.jpg
17613,Boys,Apparel,Topwear,Tshirts,Red,Fall,2011,Casual,Doodle Boys Catch Me Red Tshirt,17613.jpg
12153,Women,Apparel,Topwear,Kurtas,Green,Fall,2011,Ethnic,Aurelia Women Solid Green Kurtas,12153.jpg
26366,Women,Apparel,Topwear,Shirts,Pink,Summer,2012,Formal,Arrow Woman Pink Shirt,26366.jpg
3504,Men,Footwear,Sandal,Sandals,Brown,Fall,2010,Casual,ADIDAS Men Spry Wine Black Sandal,3504.jpg
42623,Women,Accessories,Jewellery,Earrings,Gold,Winter,2016,Casual,Estelle Women Earrings,42623.jpg
48319,Women,Accessories,Jewellery,Bracelet,Gold,Winter,2012,Casual,Pitaraa Golden Omelette Thin Bracelet,48319.jpg
30203,Unisex,Accessories,Bags,Duffel Bag,Black,Summer,2012,Casual,Nike Unisex Legend Black Duffle Bag,30203.jpg
13081,Men,Footwear,Shoes,Casual Shoes,White,Fall,2011,Casual,Numero Uno Men White Casual Shoes,13081.jpg
18469,Men,Personal Care,Fragrance,Perfume and Body Mist,White,Spring,2017,Casual,Reebok Reeplay Men Perfumes,18469.jpg
46283,Women,Apparel,Topwear,Tunics,White,Summer,2012,Casual,109F Women White Tunic,46283.jpg
23614,Men,Personal Care,Fragrance,Perfume and Body Mist,Black,Spring,2017,Casual,Nike Fragrances Men Basic Perfume 75 ml,23614.jpg
9802,Women,Apparel,Topwear,Tops,Navy Blue,Fall,2011,Casual,Scullers For Her Women Scullers Top Navy Blue Tops,9802.jpg
17421,Men,Accessories,Watches,Watches,Steel,Winter,2016,Casual,CASIO ENTICER Men White Dial Analogue Watch A417,17421.jpg
47351,Women,Accessories,Bags,Handbags,Black,Summer,2012,Casual,Baggit Women Black Bag,47351.jpg
6076,Men,Apparel,Topwear,Tshirts,White,Summer,2011,Casual,UCB Men's Polo Neck Striper White Yellow T-shirt,6076.jpg
53563,Unisex,Accessories,Watches,Watches,White,Winter,2016,Casual,Q&Q Unisex White Analog Dial Watches,53563.jpg
20091,Women,Apparel,Topwear,Sweaters,Grey,Summer,2012,Casual,United Colors of Benetton Women Grey Sweater,20091.jpg
40948,Boys,Apparel,Topwear,Tshirts,White,Summer,2012,Casual,Gini and Jony Boys Rodeo T-shirt,40948.jpg
21143,Women,Apparel,Topwear,Tops,Purple,Fall,2011,Casual,s.Oliver Women Solid Purple Top,21143.jpg
15376,Men,Footwear,Shoes,Sports Shoes,White,Fall,2011,Sports,FILA Men Fila Boston White Sports Shoes,15376.jpg
39980,Men,Footwear,Shoes,Casual Shoes,Brown,Summer,2013,Casual,Gas Men Flint Brown Shoes,39980.jpg
59059,Women,Apparel,Topwear,Kurtas,Green,Summer,2012,Ethnic,Global Desi Women Green Kurta,59059.jpg
45406,Women,Footwear,Shoes,Flats,Black,Summer,2012,Casual,Rocia Women Black Sandals,45406.jpg
4721,Boys,Apparel,Topwear,Tshirts,Red,Summer,2011,Casual,Disney Kids Boy's Royal Sailing Red Teen Kidswear,4721.jpg
10604,Unisex,Accessories,Headwear,Caps,Red,Fall,2011,Sports,Nike Unisex Tennis Red Caps,10604.jpg
33486,Women,Apparel,Dress,Dresses,Blue,Summer,2012,Casual,Doodle Kids Girl Printed Blue Dress,33486.jpg
40174,Men,Accessories,Eyewear,Sunglasses,Black,Winter,2016,Casual,Fastrack Men UV Protected Sporty Wrap Sunglasses,40174.jpg
32554,Men,Footwear,Shoes,Casual Shoes,Black,Summer,2013,Casual,Playboy Men Black Shoes,32554.jpg
56011,Women,Personal Care,Lips,Lipstick,Burgundy,Spring,2017,Casual,Colorbar Soft Touch Rhinestone Lipstick 045,56011.jpg
43395,Men,Accessories,Wallets,Wallets,Navy Blue,Summer,2012,Casual,Lino Perros Men Navy Blue Wallet,43395.jpg
17879,Men,Apparel,Innerwear,Innerwear Vests,Green,Summer,2016,Casual,Levis Men Comfort Style Green Innerwear Vest,17879.jpg
30667,Men,Accessories,Eyewear,Sunglasses,Copper,Winter,2016,Casual,Park Avenue Men Copper Sunglasses,30667.jpg
12537,Men,Apparel,Bottomwear,Track Pants,Grey,Fall,2011,Casual,Puma Men Solid Grey Track Pants,12537.jpg
26702,Women,Footwear,Shoes,Sports Shoes,White,Fall,2011,Sports,Nike Women White Court Shuttle Shoes,26702.jpg
8588,Men,Apparel,Topwear,Shirts,Blue,Fall,2011,Casual,Scullers Men Scul Blue Shirts,8588.jpg
3160,Men,Footwear,Shoes,Sports Shoes,White,Fall,2010,Sports,Nike Men's Dual Fusion White Shoe,3160.jpg
42247,Women,Apparel,Topwear,Tops,Green,Summer,2012,Casual,Sepia Women Green Top,42247.jpg
23270,Men,Accessories,Watches,Watches,Blue,Winter,2016,Casual,Maxima Ssteele Men Blue Watch,23270.jpg
28698,Women,Apparel,Topwear,Kurtas,Brown,Summer,2012,Ethnic,W Women Printed Brown Kurta,28698.jpg
17045,Men,Footwear,Sandal,Sandals,Brown,Spring,2013,Casual,Gas Men Aventura Sandal,17045.jpg
18831,Men,Accessories,Belts,Belts,Brown,Summer,2011,Formal,Peter England Men Formal Brown Belt,18831.jpg
6412,Unisex,Footwear,Shoes,Casual Shoes,Blue,Summer,2011,Casual,Lotto Unisex Canvas Blue Shoe,6412.jpg
35315,Women,Accessories,Jewellery,Earrings,Silver,Winter,2016,Ethnic,Fabindia Women Anusuya Silver Earrings,35315.jpg
51650,Men,Accessories,Watches,Watches,Brown,Winter,2016,Casual,Fossil Men Brown Dial Chronograph Watch FS4608,51650.jpg
16197,Men,Apparel,Topwear,Tshirts,Green,Fall,2011,Casual,Puma Men Rugby Green TShirt,16197.jpg
21527,Women,Accessories,Bags,Handbags,White,Winter,2015,Casual,Kiara Women Rosetti White Handbag,21527.jpg
36590,Men,Apparel,Topwear,Shirts,Red,Summer,2012,Casual,Provogue Men Eternity Red Shirt,36590.jpg
4345,Men,Footwear,Shoes,Sports Shoes,White,Summer,2012,Sports,Fila Men's Mythos White Navy Shoe,4345.jpg
24869,Men,Accessories,Mufflers,Mufflers,Blue,Fall,2011,Casual,Reid & Taylor Men Assorted Check Muffler,24869.jpg
53107,Women,Accessories,Jewellery,Earrings,Silver,Winter,2016,Casual,Fabindia Silver Earrings,53107.jpg
25187,Women,Accessories,Bags,Handbags,Brown,Winter,2015,Casual,Lino Perros Women Brown Handbag,25187.jpg
56475,Women,Personal Care,Nails,Nail Polish,Beige,Spring,2017,Casual,Streetwear Delight Nail Polish 22,56475.jpg
10260,Men,Apparel,Bottomwear,Trousers,Grey,Fall,2011,Formal,John Miller Men Line Grey Trousers,10260.jpg
24055,Men,Apparel,Topwear,Tshirts,Grey,Summer,2012,Casual,Locomotive Men Grey Striped T-shirt,24055.jpg
1637,Men,Footwear,Shoes,Sports Shoes,White,Fall,2010,Sports,Nike Men White Cricket Shoes,1637.jpg
40510,Men,Accessories,Watches,Watches,Cream,Winter,2016,Casual,Titan Men Cream Dial Watch,40510.jpg
45250,Men,Accessories,Watches,Watches,Black,Winter,2016,Casual,Casio Youth Series Men Digital Watch AE-2000W-1AVDF(D083),45250.jpg
21715,Women,Footwear,Shoes,Casual Shoes,Blue,Winter,2015,Casual,Catwalk Women Blue Casual Shoes,21715.jpg
15520,Men,Footwear,Shoes,Casual Shoes,Black,Fall,2011,Casual,Rockport Men CV Wing Black Casual Shoes,15520.jpg
44382,Men,Personal Care,Fragrance,Deodorant,Green,Spring,2017,Casual,ADIDAS Men Pure Game Deo,44382.jpg
11180,Men,Accessories,Watches,Watches,Brown,Winter,2016,Casual,Carrera Men White Dial Watch,11180.jpg
56647,Women,Apparel,Topwear,Kurtis,Pink,Fall,2012,Ethnic,Mumbai Slang Women Pink Kurti,56647.jpg
38638,Men,Apparel,Topwear,Tshirts,Black,Summer,2012,Casual,Nike Men Printed Black T-shirt,38638.jpg
57795,Women,Personal Care,Skin Care,Face Wash and Cleanser,Red,Spring,2017,Casual,Lotus Herbals Pomegranate & Plum Skin Polisher,57795.jpg
10052,Women,Apparel,Bottomwear,Shorts,Black,Fall,2011,Casual,Puma Women Trunk Black Shorts,10052.jpg
5899,Men,Footwear,Shoes,Casual Shoes,Black,Summer,2011,Casual,Puma Men's Mid Spill Black Shoe,5899.jpg
24267,Men,Apparel,Topwear,Shirts,Blue,Summer,2012,Casual,Quiksilver Men Blue Check Shirt,24267.jpg
54110,Women,Footwear,Shoes,Heels,Black,Winter,2012,Casual,Rocia Women Black Flats,54110.jpg
2280,Women,Apparel,Topwear,Tshirts,Pink,Fall,2010,Sports,Nike Womens Sphere Pink T-shirt,2280.jpg
3352,Men,Apparel,Topwear,Tshirts,Yellow,Summer,2011,Casual,Myntra Men's I Am Not Lazy Yellow T-shirt,3352.jpg
31587,Men,Apparel,Topwear,Tshirts,Black,Summer,2012,Casual,Mark Taylor Men Printed Black T-shirt,31587.jpg
42075,Men,Accessories,Wallets,Wallets,Black,Summer,2015,Casual,American Tourister Men Black Wallet,42075.jpg
12705,Men,Footwear,Shoes,Sports Shoes,White,Fall,2011,Sports,Nike Men Air Courtballistic White Sports Shoes,12705.jpg
26530,Men,Footwear,Shoes,Casual Shoes,Purple,Spring,2013,Casual,Gas Men Aishley Greyish Purple Casual Shoes,26530.jpg
47507,Men,Apparel,Innerwear,Innerwear Vests,White,Summer,2016,Casual,Facit Men White Facit Innerwear Vest,47507.jpg
6620,Men,Footwear,Shoes,Sports Shoes,White,Summer,2011,Sports,ADIDAS Men's Ridley White Silver Shoe,6620.jpg
23042,Men,Apparel,Bottomwear,Trousers,Navy Blue,Fall,2011,Formal,Arrow Men Navy Blue Trousers,23042.jpg
17277,Men,Apparel,Topwear,Tshirts,Navy Blue,Fall,2011,Casual,U.S. Polo Assn. Men Printed Navy Blue Tshirt,17277.jpg
51462,Women,Apparel,Topwear,Tops,Brown,Summer,2012,Casual,Tonga Women Brown Top,51462.jpg
42849,Women,Accessories,Bags,Clutches,Black,Summer,2012,Casual,French Connection Women Black Clutch,42849.jpg
22190,Men,Footwear,Shoes,Casual Shoes,Brown,Fall,2012,Casual,Timberland Men Light Brown Casual Shoes,22190.jpg
29578,Unisex,Accessories,Bags,Backpacks,Green,Summer,2012,Casual,ADIDAS Unisex Boston Celtics Green Backpack,29578.jpg
35127,Women,Accessories,Jewellery,Necklace and Chains,Metallic,Summer,2012,Casual,Allen Solly Woman Metal Necklace,35127.jpg
51802,Women,Apparel,Loungewear and Nightwear,Nightdress,Navy Blue,Summer,2016,Casual,Bwitch  Navy Blue  Nightdress,51802.jpg
42429,Women,Apparel,Topwear,Kurtas,Orange,Summer,2012,Ethnic,Aurelia  Women Orange Kurta,42429.jpg
29918,Men,Accessories,Watches,Watches,Grey,Winter,2016,Casual,Police Men Grey Dial Watch PL12698JSU,29918.jpg
48113,Women,Accessories,Belts,Belts,Brown,Summer,2012,Casual,Fossil Women Brown Belt,48113.jpg
26950,Women,Apparel,Topwear,Tshirts,Maroon,Summer,2012,Casual,Jealous 21 Women Printed Maroon T-shirt,26950.jpg
46089,Women,Footwear,Shoes,Sports Shoes,White,Summer,2012,Sports,ADIDAS Women White Galaxy Arriba Sports Shoes,46089.jpg
29124,Men,Footwear,Shoes,Sports Shoes,Black,Fall,2012,Sports,Puma Men Aquil Black Sports Shoes,29124.jpg
30835,Women,Apparel,Topwear,Kurtas,Pink,Summer,2012,Ethnic,Fabindia Women Fushsia Pink Kurta,30835.jpg
27882,Women,Apparel,Topwear,Shirts,Olive,Summer,2012,Casual,Scullers For Her Olive Shirt,27882.jpg
1865,Men,Apparel,Topwear,Tshirts,White,Summer,2011,Casual,Inkfruit Men Operation Kick,1865.jpg
58381,Men,Apparel,Topwear,Tshirts,Grey,Summer,2012,Casual,Locomotive Men Grey T-shirt,58381.jpg
21349,Men,Accessories,Eyewear,Sunglasses,Silver,Winter,2016,Casual,Pal Zileri Men Casual Metalic Frame Sunglasses,21349.jpg
59253,Men,Accessories,Watches,Watches,Bronze,Winter,2016,Casual,Titan Men Bronze Chronograph Dial Watch,59253.jpg
14892,Women,Accessories,Bags,Backpacks,Blue,Summer,2011,Casual,United Colors of Benetton Women Solid Blue Backpacks,14892.jpg
15940,Men,Accessories,Belts,Belts,Brown,Fall,2011,Casual,Turtle Men Leather Brown Belts,15940.jpg
