id,gender,masterCategory,subCategory,articleType,baseColour,season,year,usage,productDisplayName,image
15970,Men,Apparel,Topwear,Shirts,Navy Blue,Fall,2011,Casual,Turtle Check Men Navy Blue Shirt,15970.jpg
39386,Men,Apparel,Bottomwear,Jeans,Blue,Summer,2012,Casual,Peter England Men Party Blue Jeans,39386.jpg
59263,Women,Accessories,Watches,Watches,Silver,Winter,2016,Casual,Titan Women Silver Watch,59263.jpg
21379,Men,Apparel,Bottomwear,Track Pants,Black,Fall,2011,Casual,Manchester United Men Solid Black Track Pants,21379.jpg
53759,Men,Apparel,Topwear,Tshirts,Grey,Summer,2012,Casual,Puma Men Grey T-shirt,53759.jpg
1855,Men,Apparel,Topwear,Tshirts,Grey,Summer,2011,Casual,Inkfruit Mens Chain Reaction T-shirt,1855.jpg
30805,Men,Apparel,Topwear,Shirts,Green,Summer,2012,Ethnic,Fabindia Men Striped Green Shirt,30805.jpg
26960,Women,Apparel,Topwear,Shirts,Purple,Summer,2012,Casual,Jealous 21 Women Purple Shirt,26960.jpg
29114,Men,Accessories,Socks,Socks,Navy Blue,Summer,2012,Casual,Puma Men Pack of 3 Socks,29114.jpg
30039,Men,Accessories,Watches,Watches,Black,Winter,2016,Casual,Skagen Men Black Watch,30039.jpg
9204,Men,Footwear,Shoes,Casual Shoes,Black,Summer,2011,Casual,Puma Men Future Cat Remix SF Black Casual Shoes,9204.jpg
48123,Women,Accessories,Belts,Belts,Black,Summer,2012,Casual,Fossil Women Black Huarache Weave Belt,48123.jpg
18653,Men,Footwear,Flip Flops,Flip Flops,Black,Fall,2011,Casual,Fila Men Cush Flex Black Slippers,18653.jpg
47957,Women,Accessories,Bags,Handbags,Blue,Summer,2012,Casual,Murcia Women Blue Handbag,47957.jpg
46885,Boys,Footwear,Flip Flops,Flip Flops,Navy Blue,Fall,2012,Casual,Ben 10 Boys Navy Blue Slippers,46885.jpg
12369,Men,Apparel,Topwear,Shirts,Purple,Fall,2011,Formal,Reid & Taylor Men Check Purple Shirts,12369.jpg
29928,Men,Accessories,Watches,Watches,Black,Winter,2016,Casual,Police Men Black Dial Watch PL12889JVSB,29928.jpg
42419,Girls,Apparel,Topwear,Tops,White,Summer,2012,Casual,Gini and Jony Girls Knit White Top,42419.jpg
51832,Women,Apparel,Innerwear,Bra,Beige,Summer,2016,Casual,Bwitch Beige Full-Coverage Bra BW335,51832.jpg
47359,Women,Accessories,Bags,Handbags,Brown,Summer,2012,Casual,Baggit Women Brown Handbag,47359.jpg
17429,Men,Accessories,Watches,Watches,Black,Winter,2016,Casual,CASIO G-Shock Men Black Digital Watch G-7710-1DR G223,17429.jpg
12967,Men,Footwear,Sandal,Sandals,Black,Fall,2011,Casual,ADIDAS Men Spry M Black Sandals,12967.jpg
6842,Unisex,Accessories,Shoe Accessories,Shoe Accessories,Black,Summer,2011,Casual,Timberland Unisex Rubber Sole Brush Shoe Accessories,6842.jpg
13089,Men,Apparel,Topwear,Sweatshirts,Grey,Fall,2011,Sports,ADIDAS Men Lfc Auth Hood Grey Sweatshirts,13089.jpg
18461,Men,Personal Care,Fragrance,Deodorant,White,Spring,2017,Casual,David Beckham Signature Men Deos,18461.jpg
9036,Men,Footwear,Shoes,Formal Shoes,Black,Winter,2011,Formal,Buckaroo Men Flores Black Formal Shoes,9036.jpg
48311,Women,Accessories,Jewellery,Bracelet,Bronze,Winter,2012,Casual,Pitaraa Women Bronze Beaded Bracelet,48311.jpg
7990,Men,Apparel,Topwear,Tshirts,Navy Blue,Fall,2011,Sports,Fila Men's Round Neck Navy Blue T-shirt,7990.jpg
56019,Women,Personal Care,Lips,Lipstick,Brown,Spring,2017,Casual,Colorbar Soft Touch Show Stopper Copper Lipstick 037,56019.jpg
21977,Women,Accessories,Bags,Handbags,Brown,Winter,2015,Casual,Murcia Women Casual Brown Handbag,21977.jpg
37812,Men,Apparel,Topwear,Shirts,Navy Blue,Summer,2012,Formal,John Players Men Navy Blue Shirt,37812.jpg
4729,Boys,Apparel,Topwear,Tshirts,Green,Summer,2011,Casual,Disney Kids Boy's Crew Sea Life Sialing Green Teen Kidswear,4729.jpg
56825,Men,Apparel,Topwear,Shirts,Brown,Summer,2012,Casual,John Players Men Brown Shirt,56825.jpg
39988,Men,Footwear,Shoes,Casual Shoes,White,Winter,2014,Casual,Gas Men Europa White Shoes,39988.jpg
59051,Women,Footwear,Shoes,Flats,Black,Winter,2012,Casual,Carlton London Women Black & Gold Toned Flats,59051.jpg
20099,Women,Apparel,Topwear,Kurtas,Green,Fall,2011,Ethnic,Diva Women Embroided Green Kurta,20099.jpg
58183,Women,Accessories,Bags,Handbags,White,Summer,2012,Casual,Rocky S Women White Handbag,58183.jpg
29742,Women,Accessories,Bags,Handbags,Teal,Summer,2012,Casual,Kiara Women Teal Handbag,29742.jpg
51658,Women,Accessories,Watches,Watches,Copper,Winter,2016,Casual,Fossil Women Copper Chronograph Watch CH2589,51658.jpg
3954,Women,Apparel,Topwear,Tshirts,Pink,Summer,2011,Casual,Jealous 21 Women's Pink T-shirt,3954.jpg
18839,Men,Accessories,Belts,Belts,Black,Fall,2011,Formal,Peter England Men Formal Black Belt,18839.jpg
2886,Women,Footwear,Shoes,Flats,Brown,Winter,2015,Casual,Catwalk Women Leather Brown Flats,2886.jpg
23278,Men,Accessories,Watches,Watches,Off White,Winter,2016,Casual,Maxima Ssteele Men Off White Watch,23278.jpg
28690,Women,Apparel,Topwear,Kurtas,Beige,Summer,2012,Ethnic,W Women Printed Beige Kurta,28690.jpg
8580,Men,Apparel,Topwear,Waistcoat,Grey,Fall,2011,Casual,Scullers Men  Grey Waistcoat,8580.jpg
3168,Men,Footwear,Shoes,Sports Shoes,White,Fall,2010,Sports,Nike Men's Incinerate MSL White Blue Shoe,3168.jpg
18005,Men,Apparel,Bottomwear,Shorts,Black,Summer,2011,Sports,Puma Men Long Logo Black Bermuda,18005.jpg
17871,Men,Apparel,Innerwear,Briefs,Maroon,Winter,2016,Casual,Levis Men Boxer Maroon Brief,17871.jpg
9452,Men,Apparel,Topwear,Shirts,Red,Fall,2011,Formal,John Miller Men Stripes White Red Shirts,9452.jpg
38402,Women,Accessories,Belts,Belts,Black,Summer,2012,Casual,Baggit Women Hood Dabang Black Belt,38402.jpg
44984,Women,Accessories,Watches,Watches,White,Winter,2016,Casual,Maxima Women White Dial Watch,44984.jpg
10268,Men,Footwear,Shoes,Formal Shoes,Black,Fall,2012,Formal,Clarks Men Hang Work Leather Black Formal Shoes,10268.jpg
45856,Women,Apparel,Topwear,Kurtas,Brown,Summer,2012,Ethnic,Vishudh Women Brown Kurta,45856.jpg
32138,Men,Apparel,Innerwear,Briefs,Blue,Summer,2016,Casual,Playboy Men Blue Titanium Briefs,32138.jpg
59435,Men,Footwear,Shoes,Formal Shoes,Black,Summer,2012,Formal,Arrow Men Black Formal Shoes,59435.jpg
5891,Men,Apparel,Topwear,Tshirts,Black,Summer,2011,Casual,Puma Men's Stripe Polo Black T-shirt,5891.jpg
38630,Women,Apparel,Topwear,Tshirts,Purple,Summer,2012,Casual,Nike Women Purple Polo T-shirt,38630.jpg
4943,Men,Apparel,Topwear,Shirts,White,Summer,2011,Casual,Gini and Jony Boy's Kaleb White Brown Kidswear,4943.jpg
11188,Men,Accessories,Watches,Watches,Silver,Winter,2016,Casual,Carrera Men Dial steel finish strap Silver Watches,11188.jpg
10866,Men,Apparel,Topwear,Tshirts,Red,Fall,2011,Casual,Wrangler Men Motor Rider Red T-Shirts,10866.jpg
59607,Women,Apparel,Saree,Sarees,Grey,Fall,2012,Ethnic,FNF Pink & Grey Wedding Collection Sari,59607.jpg
15528,Men,Apparel,Topwear,Tshirts,Black,Fall,2011,Casual,Puma Men Scribble Black Tshirts,15528.jpg
45258,Men,Accessories,Watches,Watches,Black,Winter,2016,Casual,CASIO EDIFICE Men Black Dial Chronograph Watch ED60,45258.jpg
42841,Women,Accessories,Bags,Handbags,Beige,Summer,2012,Casual,French Connection Women Beige Handbag,42841.jpg
22198,Men,Footwear,Shoes,Casual Shoes,Black,Fall,2012,Casual,Timberland Men Black Casual Shoes,22198.jpg
29570,Men,Footwear,Shoes,Casual Shoes,Purple,Summer,2012,Casual,Vans Men Classic Slip-On Purple & Black Shoes,29570.jpg
43993,Women,Personal Care,Fragrance,Perfume and Body Mist,Pink,Spring,2017,Casual,Police Women Passion Perfume,43993.jpg
6628,Men,Footwear,Shoes,Sports Shoes,White,Summer,2011,Sports,ADIDAS Men's Lowell White Silver Shoe,6628.jpg
54924,Men,Apparel,Bottomwear,Shorts,Blue,Summer,2012,Casual,Do U Speak Green Men Blue Shorts,54924.jpg
26538,Men,Footwear,Shoes,Casual Shoes,Red,Fall,2012,Casual,ID Men Red Shoes,26538.jpg
35913,Women,Accessories,Bags,Handbags,Black,Summer,2012,Casual,Peperone Women Black & White Handbag,35913.jpg
49495,Men,Footwear,Shoes,Casual Shoes,Khaki,Summer,2012,Casual,Vans Men Khaki Shoes,49495.jpg
9660,Men,Apparel,Topwear,Shirts,Pink,Fall,2011,Casual,Indigo Nation Men Reversible Bling Pink Shirts,9660.jpg
2288,Women,Apparel,Topwear,Tshirts,Black,Fall,2010,Sports,Nike Women Black T-shirt,2288.jpg
23876,Men,Apparel,Topwear,Sweatshirts,Blue,Fall,2011,Casual,ADIDAS Men Blue Sweatshirt,23876.jpg
18237,Men,Apparel,Topwear,Tshirts,Red,Fall,2011,Casual,Manchester United Men Solid Red Tshirt,18237.jpg
54118,Women,Footwear,Shoes,Heels,Black,Winter,2012,Casual,Rocia Women Black Flats,54118.jpg
2872,Women,Footwear,Shoes,Heels,Brown,Winter,2015,Casual,Catwalk Women Leather Flats,2872.jpg
49653,Women,Apparel,Topwear,Tops,Green,Summer,2012,Casual,Mineral Women Green Top,49653.jpg
8574,Women,Footwear,Sandal,Sandals,Pink,Fall,2011,Casual,Crocs Dora Boots Pink Sandals,8574.jpg
16957,Men,Accessories,Eyewear,Sunglasses,Black,Winter,2016,Casual,Image Men Sunglasses,16957.jpg
19123,Men,Footwear,Flip Flops,Flip Flops,Silver,Fall,2011,Casual,Lotto Men XL Water Man Silver Slippers,19123.jpg
13419,Men,Apparel,Topwear,Tshirts,Pink,Summer,2011,Casual,United Colors of Benetton Men Solid Pink Polo T-shirts,13419.jpg
17885,Men,Apparel,Innerwear,Innerwear Vests,Grey,Summer,2016,Casual,Levis Men Comfort Style Grey Innerwear Vest,17885.jpg
43369,Men,Footwear,Flip Flops,Flip Flops,Black,Summer,2013,Casual,Reebok Men Black Possession Flip Flops,43369.jpg
48781,Women,Accessories,Jewellery,Pendant,Silver,Summer,2012,Casual,Lucera Women Silver Pendant,48781.jpg
44970,Men,Accessories,Watches,Watches,White,Winter,2016,Casual,Maxima Men White Dial Analog Chronograph Watch,44970.jpg
56489,Women,Personal Care,Nails,Nail Polish,Bronze,Spring,2017,,Streetwear Ash Nail Polish # 31,56489.jpg
39524,Unisex,Accessories,Bags,Laptop Bag,Orange,Summer,2012,Casual,Peter England Unisex Orange Sleeve Bag,39524.jpg
33822,Men,Footwear,Shoes,Sports Shoes,White,Summer,2012,Sports,Puma Men Axis White & Grey Sports Shoes,33822.jpg
58513,Women,Apparel,Topwear,Tops,Off White,Summer,2012,Casual,Tonga Women Maroon Top,58513.jpg
25947,Women,Accessories,Scarves,Scarves,Brown,Summer,2012,Casual,Femella Women Brown Scarf,25947.jpg
52029,Unisex,Apparel,Topwear,Rain Jacket,Coffee Brown,Summer,2012,,Just Natural Unisex Charcoal Rain Jacket,52029.jpg
5865,Men,Apparel,Topwear,Tshirts,Black,Summer,2011,Casual,ADIDAS Men's Twelve Faster T-shirt,5865.jpg
39716,Women,Apparel,Dress,Dresses,Blue,Summer,2012,Casual,Arrow Woman Women Blue Dress,39716.jpg
25349,Men,Apparel,Innerwear,Briefs,Red,Summer,2016,Casual,Levis Men Red Brief,25349.jpg
11940,Men,Footwear,Sandal,Sandals,Black,Summer,2011,Casual,Ganuchi Men Casual Black Sandals,11940.jpg
55802,Women,Apparel,Loungewear and Nightwear,Night suits,White,Summer,2017,Casual,SDL by Sweet Dreams Women Green Printed Night Suit S11-3124,55802.jpg
29584,Men,Apparel,Topwear,Tshirts,Black,Summer,2012,Casual,Indigo Nation Men Printed Black T-shirt,29584.jpg
43967,Women,Personal Care,Fragrance,Perfume and Body Mist,Red,Spring,2017,Casual,DKNY Women Red Delicious Perfume,43967.jpg
28456,Women,Apparel,Bottomwear,Skirts,Blue,Summer,2012,Sports,Urban Yoga Women Blue Skirt With Leggings,28456.jpg
34009,Girls,Apparel,Topwear,Tops,Black,Summer,2012,Casual,Gini and Jony Girls Black Top,34009.jpg
19311,Men,Footwear,Shoes,Casual Shoes,White,Fall,2011,Casual,Nike Men Air Rift MTR White Casual Shoe,19311.jpg
42089,Men,Footwear,Shoes,Sports Shoes,White,Summer,2012,Sports,ADIDAS Men White Corona Sports Shoes,42089.jpg
22950,Unisex,Accessories,Watches,Watches,Black,Winter,2016,Casual,Fastrack Unisex Black Dial Watch 9915PP13,22950.jpg
49461,Men,Footwear,Shoes,Casual Shoes,Blue,Summer,2012,Casual,Vans Men Blue Era Scilla Plaid Shoes,49461.jpg
8746,Unisex,Footwear,Flip Flops,Flip Flops,Navy Blue,Summer,2015,Casual,Crocs Kids Navy Blue Clogs,8746.jpg
9694,Men,Apparel,Topwear,Tshirts,White,Fall,2011,Casual,Classic Polo Men Vulcan White Polo Tshirts,9694.jpg
23882,Men,Footwear,Shoes,Sports Shoes,Grey,Fall,2011,Sports,Fila Men Destiny Grey Sports Shoes,23882.jpg
34835,Men,Footwear,Shoes,Sports Shoes,Blue,Summer,2012,Sports,ADIDAS Men Blue Chill Sports Shoes,34835.jpg
15984,Men,Apparel,Topwear,Shirts,Yellow,Fall,2011,Casual,Turtle Check Men Yellow Shirt,15984.jpg
41268,Men,Accessories,Wallets,Wallets,Black,Summer,2012,Casual,Arrow Men Black Wallet,41268.jpg
11518,Women,Footwear,Shoes,Heels,Grey,Winter,2015,Casual,Catwalk Women Gun Metal Grey Heels,11518.jpg
14856,Women,Accessories,Wallets,Wallets,Beige,Summer,2011,Casual,United Colors of Benetton Women Solid Beige Wallets,14856.jpg
33648,Men,Footwear,Sandal,Sandals,Brown,Summer,2012,Casual,Lotto Men Ridge Brown Sandals,33648.jpg
59297,Men,Apparel,Topwear,Shirts,White,Fall,2012,Casual,U.S. Polo Assn. Men White & Navy Blue Shirt,59297.jpg
28032,Men,Apparel,Innerwear,Briefs,White,Summer,2016,Casual,Jockey ELANCE Men Bikini White Brief 1005,28032.jpg
27846,Women,Apparel,Topwear,Blazers,Charcoal,Summer,2012,Formal,Scullers For Her Charcoal Blazer,27846.jpg
26994,Women,Apparel,Bottomwear,Jeans,Black,Summer,2012,Casual,Jealous 21 Women Black Jeans,26994.jpg
49839,Women,Footwear,Flip Flops,Flip Flops,Red,Winter,2012,Casual,iPanema Women Red Flip Flops,49839.jpg
31923,Women,Accessories,Bags,Handbags,Blue,Summer,2012,Casual,Fabindia Women Blue Silk Sling Bag,31923.jpg
2618,Women,Footwear,Shoes,Flats,Silver,Spring,2010,Casual,Carlton London Women Silver Wedge Sandal,2618.jpg
54588,Women,Apparel,Topwear,Kurtas,Green,Summer,2012,Ethnic,Sushilas Women Printed Green Kurta,54588.jpg
49005,Women,Accessories,Jewellery,Ring,Silver,Summer,2012,Casual,Lucera Women Silver Ring,49005.jpg
8322,Boys,Apparel,Topwear,Tshirts,Blue,Fall,2011,Casual,Doodle Boy's Route 66 Biker Blue Teen Kidswear,8322.jpg
13841,Unisex,Accessories,Watches,Watches,White,Winter,2016,Casual,ADIDAS Unisex Three Small Dials White Watches,13841.jpg
28200,Men,Accessories,Eyewear,Sunglasses,Copper,Winter,2016,Casual,Ray-Ban Men Active Lifestyle Copper Sunglasses,28200.jpg
12993,Unisex,Footwear,Shoes,Sports Shoes,Black,Fall,2011,Sports,ADIDAS Kids Adispeed Black Sports Shoes,12993.jpg
7158,Men,Apparel,Topwear,Shirts,Green,Fall,2011,Casual,Scullers Men  Green Check Shirt,7158.jpg
18495,Men,Footwear,Sandal,Sandals,White,Fall,2011,Casual,Puma Men Fashion Cat White Slipper,18495.jpg
8110,Men,Accessories,Watches,Watches,Black,Winter,2016,Casual,Fastrack Men Economy 2 Analg Black Watch,8110.jpg
19547,Men,Apparel,Topwear,Sweatshirts,Blue,Fall,2011,Casual,United Colors of Benetton Men Solid Blue Sweatshirt,19547.jpg
7964,Men,Apparel,Topwear,Tshirts,Black,Fall,2011,Sports,Puma Men's Large Logo Graphic Black T-shirt,7964.jpg
36934,Women,Personal Care,Fragrance,Perfume and Body Mist,Gold,Spring,2017,Casual,Giorgio Armani Women Idole Perfume,36934.jpg
39140,Women,Apparel,Apparel Set,Kurta Sets,Black,Summer,2012,Ethnic,Aneri Women Black & Maroon Salwar Suit,39140.jpg
20851,Women,Accessories,Bags,Clutches,Red,Winter,2015,Casual,Spice Art Women Ribbon Embroidery Red Clutch,20851.jpg
41866,Men,Footwear,Sandal,Sandals,Beige,Fall,2015,Casual,Estd. 1977 Men Beige & Green Sandals,41866.jpg
58177,Women,Accessories,Bags,Handbags,Brown,Summer,2012,Casual,Rocky S Women Brown Handbag,58177.jpg
44528,Men,Footwear,Sandal,Sandals,Black,Summer,2012,Casual,Coolers Men Black Sandals,44528.jpg
16392,Men,Apparel,Topwear,Shirts,Red,Fall,2011,Casual,Levis Men Check Red Shirts,16392.jpg
51455,Women,Apparel,Topwear,Shrug,Pink,Summer,2012,Casual,Tonga Women Pink Printed Shrug,51455.jpg
50587,Men,Apparel,Innerwear,Briefs,Grey,Summer,2016,Casual,Chromozome Men Grey Briefs,50587.jpg
17240,Men,Apparel,Topwear,Tshirts,Black,Fall,2011,Casual,U.S. Polo Assn. Men Stripes Black  Polo Tshirt,17240.jpg
47530,Women,Footwear,Shoes,Flats,Copper,Winter,2012,Casual,Portia Women Copper-Toned & Brown Sandals,47530.jpg
6617,Men,Apparel,Topwear,Shirts,Black,Summer,2011,Casual,Spykar Men Black and white Check Shirt,6617.jpg
12732,Unisex,Accessories,Bags,Backpacks,Black,Fall,2011,Sports,Nike Unisex Swoosh Black Backpack,12732.jpg
3365,Men,Apparel,Topwear,Tshirts,Black,Summer,2011,Casual,Myntra Men's Brain Black T-shirt,3365.jpg
42042,Men,Footwear,Shoes,Sports Shoes,White,Summer,2012,Sports,Nike Men Air Relentless 2 MSL White Sports Shoes,42042.jpg
23849,Men,Footwear,Shoes,Casual Shoes,Black,Fall,2011,Casual,ADIDAS Men Black Anzo Breeze Casual Shoes,23849.jpg
43190,Women,Accessories,Watches,Watches,White,Winter,2016,Casual,Fastrack Women White Dial Watch,43190.jpg
48578,Men,Accessories,Jewellery,Bracelet,Steel,Summer,2012,Casual,Revv Men Steel Bracelet,48578.jpg
30462,Women,Apparel,Innerwear,Bra,Black,Summer,2014,Casual,Lovable Women All Day Long Black Bra,30462.jpg
18208,Men,Accessories,Headwear,Caps,White,Fall,2011,Casual,Manchester United Men Solid White Cap,18208.jpg
54127,Women,Footwear,Shoes,Heels,Black,Winter,2012,Casual,Rocia Women Black Heels,54127.jpg
10065,Men,Apparel,Topwear,Tshirts,Yellow,Fall,2011,Casual,Puma Men ducati logo tee Yellow Tshirts,10065.jpg
24250,Men,Footwear,Shoes,Casual Shoes,White,Fall,2012,Casual,Numero Uno Men White Casual Shoes,24250.jpg
32335,Men,Accessories,Watches,Watches,Silver,Winter,2016,Casual,Q&Q Men Silver-Toned Dial Analogue Watch Q252J404Y,32335.jpg
25382,Men,Apparel,Innerwear,Innerwear Vests,White,Summer,2016,Casual,Levis Men White Innerwear Vest,25382.jpg
56670,Men,Accessories,Watches,Watches,Black,Winter,2016,Casual,Maxima Men Black Dial Watch,56670.jpg
5092,Men,Apparel,Topwear,Tshirts,Purple,Summer,2011,Casual,Wrangler Men's Minstrel Shoulder Loop Purple T-shirt,5092.jpg
10859,Men,Apparel,Topwear,Tshirts,Navy Blue,Fall,2011,Casual,Wrangler Men Furious Rides Navy Blue T-Shirts,10859.jpg
59638,Women,Apparel,Saree,Sarees,Green,Fall,2012,Ethnic,FNF Green Wedding Collection Sari,59638.jpg
15517,Men,Footwear,Shoes,Casual Shoes,Red,Fall,2011,Casual,Rockport Men LLandro Red Casual Shoes,15517.jpg
4140,Women,Footwear,Shoes,Casual Shoes,Green,Winter,2015,Casual,Skechers Women Green Shoe,4140.jpg
36795,Men,Accessories,Watches,Watches,Silver,Winter,2016,Casual,Maxima Men Ssteele Silver Dial Watch,36795.jpg
40527,Men,Accessories,Watches,Watches,Gold,Winter,2016,Casual,Titan Men Gold Dial Watch,40527.jpg
10257,Men,Apparel,Bottomwear,Trousers,Black,Fall,2011,Formal,John Miller Men Solid Type Black Trousers,10257.jpg
24062,Men,Apparel,Topwear,Tshirts,Navy Blue,Summer,2012,Casual,Locomotive Men Navy Blue Printed T-shirt,24062.jpg
45869,Men,Accessories,Watches,Watches,Brown,Winter,2016,Casual,Maxima Men Brown Dial Watch,45869.jpg
11385,Women,Apparel,Topwear,Sweatshirts,Black,Fall,2011,Casual,United Colors Of Benetton Women Light Winter Black Sweatshirts,11385.jpg
53130,Women,Footwear,Shoes,Flats,Brown,Winter,2015,Casual,Catwalk Women Brown Sandals,53130.jpg
44187,Women,Personal Care,Fragrance,Perfume and Body Mist,White,Spring,2017,Casual,Nike Fragrances Women 5th Element Perfume 150 ml,44187.jpg
21510,Women,Accessories,Bags,Handbags,White,Winter,2015,Casual,Kiara Women Graphiti White Handbag,21510.jpg
51667,Men,Accessories,Eyewear,Sunglasses,Grey,Winter,2016,Casual,Louis Philippe Men Grey Sunglasses,51667.jpg
22395,Men,Apparel,Topwear,Shirts,Blue,Fall,2011,Casual,Mark Taylor Men Striped Blue Shirt,22395.jpg
35322,Women,Accessories,Jewellery,Earrings,Silver,Winter,2016,Ethnic,Fabindia Women Anusuya Silver Earrings,35322.jpg
6425,Unisex,Footwear,Shoes,Casual Shoes,Black,Summer,2011,Casual,Lotto Unisex Canvas Black Check Shoe,6425.jpg
18806,Men,Accessories,Belts,Belts,Tan,Summer,2011,Casual,Peter England Men Casual Tan Belt,18806.jpg
23247,Men,Footwear,Shoes,Formal Shoes,Black,Fall,2011,Formal,Arrow Men Formal Black Shoe,23247.jpg
17072,Women,Accessories,Belts,Belts,Grey,Winter,2015,Casual,Lino Perros Women Weaved  Grey Belt,17072.jpg
31782,Women,Apparel,Topwear,Tops,Blue,Summer,2012,Casual,Lee Women Paula Blue Top,31782.jpg
42270,Unisex,Footwear,Shoes,Casual Shoes,Black,Summer,2012,Casual,Vans Unisex Black & Grey Classic Shoes,42270.jpg
12500,Men,Apparel,Topwear,Shirts,Black,Fall,2011,Casual,United Colors of Benetton Men Short Black Shirts,12500.jpg
26735,Men,Personal Care,Fragrance,Deodorant,Black,Spring,2017,Casual,Reebok Men Pack of 2 Pirates of the Caribbean Deos,26735.jpg
30650,Men,Apparel,Topwear,Tshirts,Black,Summer,2012,Casual,Nike Men Printed Black T-shirt,30650.jpg
56026,Women,Personal Care,Lips,Lipstick,Brown,Spring,2017,Casual,Colorbar Soft Touch Mousse Lipstick 025,56026.jpg
21948,Women,Accessories,Bags,Handbags,Brown,Winter,2015,Casual,Murcia Women Casual Brown Handbag,21948.jpg
32563,Women,Apparel,Bottomwear,Trousers,Blue,Summer,2012,Casual,ONLY Women directoire blue Trousers,32563.jpg
58980,Women,Personal Care,Fragrance,Deodorant,Pink,Spring,2017,Casual,Colour me Women Flowers Deo,58980.jpg
40143,Girls,Apparel,Topwear,Tops,Blue,Summer,2012,Casual,Gini and Jony Girls Pretty Blossom Blue Top,40143.jpg
10633,Men,Footwear,Shoes,Formal Shoes,Brown,Fall,2011,Formal,Carlton London Men Formal Brown Formal Shoes,10633.jpg
24406,Women,Apparel,Topwear,Kurtas,Red,Summer,2012,Ethnic,Vishudh Women Red Printed Kurta,24406.jpg
4716,Unisex,Accessories,Watches,Watches,Black,Winter,2016,Sports,ADIDAS Unisex Response ST Analogue Black Watch,4716.jpg
21174,Women,Apparel,Topwear,Tops,Beige,Fall,2011,Casual,s.Oliver Women Stripes Beige Top,21174.jpg
15341,Women,Apparel,Bottomwear,Shorts,Pink,Fall,2011,Sports,Nike Women Solid Pink Shorts,15341.jpg
52486,Women,Apparel,Innerwear,Camisoles,Maroon,Winter,2015,Casual,Red Rose Maroon Camisole,52486.jpg
53554,Men,Apparel,Innerwear,Boxers,Multi,Summer,2016,Casual,Probase Multicoloured Printed Boxers,53554.jpg
14293,Men,Apparel,Topwear,Tshirts,Blue,Fall,2011,Casual,Classic Polo Men Stripes Blue Tshirts,14293.jpg
47366,Women,Accessories,Bags,Handbags,Blue,Summer,2012,Casual,Baggit Women Blue Bag,47366.jpg
6041,Men,Apparel,Topwear,Tshirts,Navy Blue,Summer,2011,Casual,UCB Men's Polo Neck With Lion Logo Navy Blue T-shirt,6041.jpg
23623,Girls,Apparel,Topwear,Tops,Pink,Fall,2011,Casual,Doodle Kids Girls Pink I love Shopping Top,23623.jpg
17416,Men,Footwear,Shoes,Sports Shoes,Black,Fall,2011,Sports,Lotto Men Atlantica Black Sports Shoe,17416.jpg
9835,Women,Apparel,Topwear,Tshirts,Grey,Fall,2011,Casual,Little Miss Women Printed Grey T-shirt,9835.jpg
29319,Unisex,Accessories,Bags,Backpacks,Red,Summer,2012,Casual,ADIDAS Unisex Chicago Bulls Red Backpack,29319.jpg
7193,Women,Apparel,Bottomwear,Jeans,Black,Fall,2011,Casual,Jealous 21 Women Black Jegging,7193.jpg
12958,Men,Footwear,Shoes,Sports Shoes,Black,Fall,2011,Sports,ADIDAS Men Sports Black Sports Shoes,12958.jpg
27283,Women,Apparel,Topwear,Kurtas,Magenta,Fall,2011,Ethnic,Mother Earth Women Magenta Kurta,27283.jpg
30234,Men,Footwear,Flip Flops,Flip Flops,Black,Summer,2012,Casual,Numero Uno Men Black Flip Flops,30234.jpg
9009,Women,Accessories,Bags,Handbags,Brown,Winter,2015,Casual,Murcia Women Snake Print Bag Brown Handbags,9009.jpg
3533,Men,Apparel,Topwear,Tshirts,Navy Blue,Summer,2011,Casual,Myntra Men's If You Don't Like Navy Blue T-shirt,3533.jpg
42614,Women,Accessories,Jewellery,Jewellery Set,Gold,Winter,2016,Casual,Estelle Women Earrings & Pendant Set,42614.jpg
12164,Women,Apparel,Topwear,Dupatta,Orange,Fall,2011,Ethnic,Aurelia Women Voile Orange Dupatta,12164.jpg
26351,Women,Accessories,Watches,Watches,White,Winter,2016,Casual,DKNY Women White Dial Watch NY8472,26351.jpg
17624,Men,Apparel,Bottomwear,Track Pants,Navy Blue,Fall,2011,Sports,ADIDAS Men Solid Navy Blue Track Pant,17624.jpg
47154,Girls,Apparel,Bottomwear,Capris,Black,Summer,2012,Casual,Gini and Jony Girls Black Capris,47154.jpg
35574,Men,Footwear,Flip Flops,Flip Flops,Red,Summer,2013,Casual,Gliders Men Esquire Red Flip Flops,35574.jpg
46086,Women,Footwear,Shoes,Sports Shoes,Lavender,Summer,2012,Sports,ADIDAS Women Lavender Hagkok Sports Shoes,46086.jpg
51031,Women,Apparel,Innerwear,Bra,White,Summer,2017,Casual,Enamor White Bra,51031.jpg
13284,Men,Apparel,Bottomwear,Shorts,Black,Fall,2011,Casual,Gini and Jony Kids Boys Solid Black Shorts,13284.jpg
54543,Men,Footwear,Shoes,Sports Shoes,White,Fall,2012,Casual,F Sports Men White Outlander Sports Shoes,54543.jpg
55491,Women,Personal Care,Lips,Lip Gloss,Brown,Spring,2017,Casual,Revlon Gold Dust Poussiere Doree Colorburst Lip Gloss 024,55491.jpg
26163,Men,Apparel,Bottomwear,Trousers,Grey,Summer,2012,Formal,John Miller Men Dark Grey Trousers,26163.jpg
3701,Women,Apparel,Topwear,Tshirts,Black,Summer,2011,Casual,Tantra Women Flower Heart Black Long T-shirt,3701.jpg
29917,Men,Accessories,Watches,Watches,White,Winter,2016,Casual,Police Men White Dial Watch PL12698JS,29917.jpg
42426,Women,Apparel,Topwear,Kurtas,Sea Green,Summer,2012,Ethnic,Aurelia Women Sea Green Kurta,42426.jpg
32751,Men,Footwear,Shoes,Casual Shoes,Black,Summer,2012,Casual,FILA Men Liga II Black Shoes,32751.jpg
56214,Women,Accessories,Jewellery,Earrings,Gold,Winter,2016,Casual,Estelle Women Gold Earrings,56214.jpg
10401,Women,Apparel,Topwear,Tops,Purple,Fall,2011,Casual,Jealous 21 Women Uaine Purple Tops,10401.jpg
40371,Women,Apparel,Bottomwear,Jeans,Navy Blue,Summer,2012,Casual,Tokyo Talkies Women Navy Slim Fit Jeans,40371.jpg
21346,Men,Accessories,Eyewear,Sunglasses,Gold,Winter,2016,Casual,Pal Zileri Men Casual Gold Frame Sunglasses,21346.jpg
45603,Men,Footwear,Shoes,Formal Shoes,Black,Summer,2012,Formal,Arrow Men Black Formal Shoes,45603.jpg
4524,Men,Footwear,Shoes,Sports Shoes,Black,Summer,2011,Sports,Puma Men's YugoRun Black White Shoe,4524.jpg
37223,Women,Apparel,Topwear,Tops,Blue,Summer,2012,Casual,United Colors of Benetton Women Blue Top,37223.jpg
53766,Men,Apparel,Topwear,Tshirts,White,Summer,2012,Casual,Puma Men White and Navy Blue T-shirt,53766.jpg
25520,Girls,Apparel,Topwear,Tops,White,Fall,2011,Casual,Doodle Kids Girls City Chic White Top,25520.jpg
32597,Women,Apparel,Topwear,Tops,Black,Summer,2012,Casual,ONLY Women Black Top,32597.jpg
58974,Men,Personal Care,Fragrance,Deodorant,Gold,Spring,2017,Casual,Colour me Men Gold Deo,58974.jpg
33445,Women,Accessories,Wallets,Wallets,Black,Summer,2012,Casual,Baggit Women Lamboo Mayur Black Wallet,33445.jpg
57100,Women,Apparel,Topwear,Tops,Pink,Summer,2012,Casual,Elle Women Dark Pink Top,57100.jpg
36137,Women,Footwear,Shoes,Sports Shoes,Pink,Summer,2012,Sports,Nike Women Free Run Pink Sports Shoes,36137.jpg
